    1   0.000000 192.168.0.26 → 52.96.57.114 TCP 54 61504 → 993 [ACK] Seq=1 Ack=1 Win=10301 Len=0
    2   0.035597 52.96.57.114 → 192.168.0.26 TCP 60 [TCP ACKed unseen segment] 993 → 61504 [ACK] Seq=1 Ack=2 Win=4064 Len=0
    3   0.349101 192.168.0.26 → 40.99.245.66 TCP 54 62184 → 993 [FIN, ACK] Seq=1 Ack=1 Win=4096 Len=0
    4   0.353985 192.168.0.26 → 24.155.121.145 DNS 81 Standard query 0x6aab A outlook.office365.com
    5   0.365213 24.155.121.145 → 192.168.0.26 DNS 334 Standard query response 0x6aab A outlook.office365.com CNAME ooc-g2.tm-4.office.com CNAME outlook.ms-acdc.office.com CNAME DSM-efz.ms-acdc.office.com A 52.96.119.130 A 52.96.4.2 A 52.96.181.114 A 52.96.7.226 NS ns3-ms-acdc.office.com NS ns4-ms-acdc.office.com NS ns2-ms-acdc.office.com NS ns1-ms-acdc.office.com
    6   0.367420 192.168.0.26 → 52.96.119.130 TCP 78 62202 → 143 [SYN] Seq=0 Win=65535 Len=0 MSS=1460 WS=64 TSval=3271328541 TSecr=0 SACK_PERM
    7   0.397995 52.96.119.130 → 192.168.0.26 TCP 66 143 → 62202 [SYN, ACK] Seq=0 Ack=1 Win=8190 Len=0 MSS=1460 WS=16 SACK_PERM
    8   0.398154 192.168.0.26 → 52.96.119.130 TCP 54 62202 → 143 [ACK] Seq=1 Ack=1 Win=262144 Len=0
    9   0.429349 52.96.119.130 → 192.168.0.26 IMAP 214 Response: * OK The Microsoft Exchange IMAP4 service is ready. [RABNADYAUABSADAANwBDAEEAMAAxADAANQAuAG4AYQBtAHAAcgBkADAANwAuAHAAcgBvAGQALgBvAHUAdABsAG8AbwBrAC4AYwBvAG0A]
   10   0.429463 192.168.0.26 → 52.96.119.130 TCP 54 62202 → 143 [ACK] Seq=1 Ack=161 Win=262016 Len=0
   11   0.430283 192.168.0.26 → 52.96.119.130 IMAP 72 Request: 1.281 CAPABILITY
   12   0.460652 52.96.119.130 → 192.168.0.26 TCP 60 143 → 62202 [ACK] Seq=161 Ack=19 Win=1048560 Len=0
   13   0.460655 52.96.119.130 → 192.168.0.26 IMAP 205 Response: 1.281 OK CAPABILITY completed.
   14   0.460777 192.168.0.26 → 52.96.119.130 TCP 54 62202 → 143 [ACK] Seq=19 Ack=312 Win=262016 Len=0
   15   0.462431 192.168.0.26 → 52.96.119.130 IMAP 70 Request: 2.281 STARTTLS
   16   0.481819 40.99.245.66 → 192.168.0.26 TCP 60 993 → 62184 [ACK] Seq=1 Ack=2 Win=682 Len=0
   17   0.492980 52.96.119.130 → 192.168.0.26 IMAP 91 Response: 2.281 OK Begin TLS negotiation now.
   18   0.493117 192.168.0.26 → 52.96.119.130 TCP 54 62202 → 143 [ACK] Seq=35 Ack=349 Win=262144 Len=0
   19   0.493895 192.168.0.26 → 52.96.119.130 TLSv1 235 Client Hello (SNI=imap-mail.outlook.com)
   20   0.526637 52.96.119.130 → 192.168.0.26 SSL 1514 
   21   0.526790 192.168.0.26 → 52.96.119.130 TCP 54 62202 → 143 [ACK] Seq=216 Ack=1809 Win=260736 Len=0
   22   0.527339 52.96.119.130 → 192.168.0.26 TCP 1514 143 → 62202 [ACK] Seq=1809 Ack=216 Win=1048560 Len=1460
   23   0.527343 52.96.119.130 → 192.168.0.26 TCP 1514 143 → 62202 [ACK] Seq=3269 Ack=216 Win=1048560 Len=1460
   24   0.527346 52.96.119.130 → 192.168.0.26 TLSv1.2 106 Server Hello, Certificate, Certificate Status, Server Key Exchange, Server Hello Done
   25   0.527486 192.168.0.26 → 52.96.119.130 TCP 54 62202 → 143 [ACK] Seq=216 Ack=4781 Win=259200 Len=0
   26   0.527685 192.168.0.26 → 52.96.119.130 TCP 54 [TCP Window Update] 62202 → 143 [ACK] Seq=216 Ack=4781 Win=262144 Len=0
   27   0.542385 192.168.0.26 → 52.96.119.130 TLSv1.2 161 Client Key Exchange
   28   0.545902 52.96.119.130 → 192.168.0.26 TCP 1514 [TCP Spurious Retransmission] 143 → 62202 [PSH, ACK] Seq=3321 Ack=216 Win=1048560 Len=1460 [TCP PDU reassembled in 24]
   29   0.546020 192.168.0.26 → 52.96.119.130 TLSv1.2 117 Change Cipher Spec, Encrypted Handshake Message
   30   0.580345 52.96.119.130 → 192.168.0.26 TCP 60 143 → 62202 [ACK] Seq=4781 Ack=374 Win=1048560 Len=0
   31   0.580347 52.96.119.130 → 192.168.0.26 TLSv1.2 105 Change Cipher Spec, Encrypted Handshake Message
   32   0.580460 192.168.0.26 → 52.96.119.130 TCP 54 62202 → 143 [ACK] Seq=374 Ack=4832 Win=262144 Len=0
   33   0.588297 192.168.0.26 → 52.96.119.130 TLSv1.2 101 Application Data
   34   0.618227 52.96.119.130 → 192.168.0.26 TLSv1.2 235 Application Data
   35   0.618320 192.168.0.26 → 52.96.119.130 TCP 54 62202 → 143 [ACK] Seq=421 Ack=5013 Win=262016 Len=0
   36   0.619008 192.168.0.26 → 52.96.119.130 TLSv1.2 130 Application Data
   37   0.649483 52.96.119.130 → 192.168.0.26 TCP 60 143 → 62202 [ACK] Seq=5013 Ack=497 Win=1048560 Len=0
   38   1.504583 52.96.119.130 → 192.168.0.26 TLSv1.2 107 Application Data
   39   1.504735 192.168.0.26 → 52.96.119.130 TCP 54 62202 → 143 [ACK] Seq=497 Ack=5066 Win=262144 Len=0
   40   1.505911 192.168.0.26 → 52.96.119.130 TLSv1.2 97 Application Data
   41   1.506833 192.168.0.26 → 52.96.119.130 TCP 54 62202 → 143 [FIN, ACK] Seq=540 Ack=5066 Win=262144 Len=0
   42   1.510596 192.168.0.26 → 52.96.4.2    TCP 78 62203 → 993 [SYN] Seq=0 Win=65535 Len=0 MSS=1460 WS=64 TSval=4294841525 TSecr=0 SACK_PERM
   43   1.536177 52.96.119.130 → 192.168.0.26 TCP 66 [TCP Dup ACK 37#1] 143 → 62202 [ACK] Seq=5066 Ack=497 Win=1048560 Len=0 SLE=540 SRE=541
   44   1.536758 52.96.119.130 → 192.168.0.26 TCP 60 143 → 62202 [ACK] Seq=5066 Ack=541 Win=1048560 Len=0
   45   1.536759 52.96.119.130 → 192.168.0.26 TLSv1.2 170 Application Data
   46   1.536762 52.96.119.130 → 192.168.0.26 TCP 60 143 → 62202 [FIN, ACK] Seq=5182 Ack=541 Win=1048560 Len=0
   47   1.536891 192.168.0.26 → 52.96.119.130 TCP 54 62202 → 143 [RST] Seq=541 Win=0 Len=0
   48   1.536934 192.168.0.26 → 52.96.119.130 TCP 54 62202 → 143 [RST] Seq=541 Win=0 Len=0
   49   1.545404    52.96.4.2 → 192.168.0.26 TCP 66 993 → 62203 [SYN, ACK] Seq=0 Ack=1 Win=8190 Len=0 MSS=1460 WS=16 SACK_PERM
   50   1.545591 192.168.0.26 → 52.96.4.2    TCP 54 62203 → 993 [ACK] Seq=1 Ack=1 Win=262144 Len=0
   51   1.546217 192.168.0.26 → 52.96.4.2    TLSv1 235 Client Hello (SNI=imap-mail.outlook.com)
   52   1.580108    52.96.4.2 → 192.168.0.26 TCP 60 993 → 62203 [ACK] Seq=1 Ack=182 Win=10944 Len=0
   53   1.580111    52.96.4.2 → 192.168.0.26 SSL 1514 
   54   1.580248 192.168.0.26 → 52.96.4.2    TCP 54 62203 → 993 [ACK] Seq=182 Ack=1461 Win=260736 Len=0
   55   1.582535    52.96.4.2 → 192.168.0.26 TCP 1514 993 → 62203 [ACK] Seq=1461 Ack=182 Win=1048560 Len=1460
   56   1.582538    52.96.4.2 → 192.168.0.26 TCP 1514 993 → 62203 [ACK] Seq=2921 Ack=182 Win=1048560 Len=1460
   57   1.582541    52.96.4.2 → 192.168.0.26 TLSv1.2 106 Server Hello, Certificate, Certificate Status, Server Key Exchange, Server Hello Done
   58   1.582617 192.168.0.26 → 52.96.4.2    TCP 54 62203 → 993 [ACK] Seq=182 Ack=4433 Win=259200 Len=0
   59   1.582749 192.168.0.26 → 52.96.4.2    TCP 54 [TCP Window Update] 62203 → 993 [ACK] Seq=182 Ack=4433 Win=262144 Len=0
   60   1.589063    52.96.4.2 → 192.168.0.26 TCP 1514 [TCP Spurious Retransmission] 993 → 62203 [PSH, ACK] Seq=2973 Ack=182 Win=1048560 Len=1460 [TCP PDU reassembled in 57]
   61   1.589173 192.168.0.26 → 52.96.4.2    TCP 66 [TCP Dup ACK 58#1] 62203 → 993 [ACK] Seq=182 Ack=4433 Win=262144 Len=0 SLE=2973 SRE=4433
   62   1.598586 192.168.0.26 → 52.96.4.2    TLSv1.2 161 Client Key Exchange
   63   1.651028    52.96.4.2 → 192.168.0.26 TCP 60 993 → 62203 [ACK] Seq=4433 Ack=289 Win=1048560 Len=0
   64   1.651156 192.168.0.26 → 52.96.4.2    TLSv1.2 105 Change Cipher Spec, Encrypted Handshake Message
   65   1.684329    52.96.4.2 → 192.168.0.26 TLSv1.2 105 Change Cipher Spec, Encrypted Handshake Message
   66   1.684427 192.168.0.26 → 52.96.4.2    TCP 54 62203 → 993 [ACK] Seq=340 Ack=4484 Win=262144 Len=0
   67   1.717982    52.96.4.2 → 192.168.0.26 TLSv1.2 243 Application Data
   68   1.718091 192.168.0.26 → 52.96.4.2    TCP 54 62203 → 993 [ACK] Seq=340 Ack=4673 Win=262016 Len=0
   69   1.719038 192.168.0.26 → 52.96.4.2    TLSv1.2 101 Application Data
   70   1.751402    52.96.4.2 → 192.168.0.26 TLSv1.2 235 Application Data
   71   1.751512 192.168.0.26 → 52.96.4.2    TCP 54 62203 → 993 [ACK] Seq=387 Ack=4854 Win=262016 Len=0
   72   1.752481 192.168.0.26 → 52.96.4.2    TLSv1.2 214 Application Data
   73   1.784845    52.96.4.2 → 192.168.0.26 TCP 60 993 → 62203 [ACK] Seq=4854 Ack=547 Win=1048560 Len=0
   74   1.784848    52.96.4.2 → 192.168.0.26 TLSv1.2 178 Application Data
   75   1.784972 192.168.0.26 → 52.96.4.2    TCP 54 62203 → 993 [ACK] Seq=547 Ack=4978 Win=262080 Len=0
   76   1.786174 192.168.0.26 → 52.96.4.2    TLSv1.2 190 Application Data
   77   1.837700    52.96.4.2 → 192.168.0.26 TCP 60 993 → 62203 [ACK] Seq=4978 Ack=683 Win=1048560 Len=0
   78   2.862153    52.96.4.2 → 192.168.0.26 TLSv1.2 114 Application Data
   79   2.862296 192.168.0.26 → 52.96.4.2    TCP 54 62203 → 993 [ACK] Seq=683 Ack=5038 Win=262144 Len=0
   80   2.863535 192.168.0.26 → 52.96.4.2    TLSv1.2 97 Application Data
   81   2.864378 192.168.0.26 → 52.96.4.2    TCP 54 62203 → 993 [FIN, ACK] Seq=726 Ack=5038 Win=262144 Len=0
   82   2.865809 192.168.0.26 → 52.96.4.2    TCP 78 62204 → 993 [SYN] Seq=0 Win=65535 Len=0 MSS=1460 WS=64 TSval=1784656633 TSecr=0 SACK_PERM
   83   2.936486    52.96.4.2 → 192.168.0.26 TCP 114 [TCP Spurious Retransmission] 993 → 62203 [PSH, ACK] Seq=4978 Ack=683 Win=1048560 Len=60
   84   2.936489    52.96.4.2 → 192.168.0.26 TCP 66 [TCP Dup ACK 77#1] 993 → 62203 [ACK] Seq=5038 Ack=683 Win=1048560 Len=0 SLE=726 SRE=728
   85   2.936489    52.96.4.2 → 192.168.0.26 TCP 66 993 → 62204 [SYN, ACK] Seq=0 Ack=1 Win=8190 Len=0 MSS=1460 WS=16 SACK_PERM
   86   2.936490    52.96.4.2 → 192.168.0.26 TCP 60 [TCP Previous segment not captured] 993 → 62203 [FIN, ACK] Seq=5154 Ack=726 Win=1048560 Len=0
   87   2.936603 192.168.0.26 → 52.96.4.2    TCP 66 [TCP Retransmission] 62203 → 993 [FIN, ACK] Seq=726 Ack=5038 Win=262144 Len=0 SLE=4978 SRE=5038
   88   2.936676 192.168.0.26 → 52.96.4.2    TCP 66 [TCP Retransmission] 62203 → 993 [FIN, ACK] Seq=726 Ack=5038 Win=262144 Len=0 SLE=5154 SRE=5155
   89   2.936753 192.168.0.26 → 52.96.4.2    TCP 54 62204 → 993 [ACK] Seq=1 Ack=1 Win=262144 Len=0
   90   2.936771    52.96.4.2 → 192.168.0.26 TCP 60 993 → 62203 [ACK] Seq=5038 Ack=726 Win=1048560 Len=0
   91   2.936772    52.96.4.2 → 192.168.0.26 TCP 170 [TCP Out-Of-Order] 993 → 62203 [PSH, ACK] Seq=5038 Ack=726 Win=1048560 Len=116
   92   2.936890 192.168.0.26 → 52.96.4.2    TCP 54 62203 → 993 [RST] Seq=726 Win=0 Len=0
   93   2.937418 192.168.0.26 → 52.96.4.2    TLSv1 267 Client Hello (SNI=imap-mail.outlook.com)
   94   2.970060    52.96.4.2 → 192.168.0.26 TCP 60 993 → 62204 [ACK] Seq=1 Ack=214 Win=10912 Len=0
   95   2.970063    52.96.4.2 → 192.168.0.26 TCP 60 993 → 62203 [ACK] Seq=5155 Ack=727 Win=1048560 Len=0
   96   2.970221 192.168.0.26 → 52.96.4.2    TCP 54 62203 → 993 [RST] Seq=727 Win=0 Len=0
   97   2.981476    52.96.4.2 → 192.168.0.26 SSL 1514 
   98   2.981480    52.96.4.2 → 192.168.0.26 TCP 1514 993 → 62204 [ACK] Seq=1461 Ack=214 Win=1048560 Len=1460
   99   2.981482    52.96.4.2 → 192.168.0.26 TCP 1514 993 → 62204 [ACK] Seq=2921 Ack=214 Win=1048560 Len=1460
  100   2.981485    52.96.4.2 → 192.168.0.26 TLSv1.2 106 Server Hello, Certificate, Certificate Status, Server Key Exchange, Server Hello Done
  101   2.981624 192.168.0.26 → 52.96.4.2    TCP 54 62204 → 993 [ACK] Seq=214 Ack=4433 Win=257728 Len=0
  102   2.981812 192.168.0.26 → 52.96.4.2    TCP 54 [TCP Window Update] 62204 → 993 [ACK] Seq=214 Ack=4433 Win=262144 Len=0
  103   2.992113    52.96.4.2 → 192.168.0.26 TCP 1514 [TCP Spurious Retransmission] 993 → 62204 [PSH, ACK] Seq=2973 Ack=214 Win=1048560 Len=1460 [TCP PDU reassembled in 100]
  104   2.992255 192.168.0.26 → 52.96.4.2    TCP 66 [TCP Dup ACK 101#1] 62204 → 993 [ACK] Seq=214 Ack=4433 Win=262144 Len=0 SLE=2973 SRE=4433
  105   2.997567 192.168.0.26 → 52.96.4.2    TLSv1.2 161 Client Key Exchange
  106   3.053084    52.96.4.2 → 192.168.0.26 TCP 60 993 → 62204 [ACK] Seq=4433 Ack=321 Win=1048560 Len=0
  107   3.053209 192.168.0.26 → 52.96.4.2    TLSv1.2 105 Change Cipher Spec, Encrypted Handshake Message
  108   3.085558    52.96.4.2 → 192.168.0.26 TLSv1.2 105 Change Cipher Spec, Encrypted Handshake Message
  109   3.085693 192.168.0.26 → 52.96.4.2    TCP 54 62204 → 993 [ACK] Seq=372 Ack=4484 Win=262144 Len=0
  110   3.087553    52.96.4.2 → 192.168.0.26 TCP 170 [TCP Retransmission] 993 → 62203 [FIN, PSH, ACK] Seq=5038 Ack=727 Win=1048560 Len=116
  111   3.087659 192.168.0.26 → 52.96.4.2    TCP 54 62203 → 993 [RST] Seq=727 Win=0 Len=0
  112   3.117369    52.96.4.2 → 192.168.0.26 TLSv1.2 243 Application Data
  113   3.117508 192.168.0.26 → 52.96.4.2    TCP 54 62204 → 993 [ACK] Seq=372 Ack=4673 Win=262016 Len=0
  114   3.118407 192.168.0.26 → 52.96.4.2    TLSv1.2 101 Application Data
  115   3.147447    52.96.4.2 → 192.168.0.26 TLSv1.2 235 Application Data
  116   3.147581 192.168.0.26 → 52.96.4.2    TCP 54 62204 → 993 [ACK] Seq=419 Ack=4854 Win=262016 Len=0
  117   3.148320 192.168.0.26 → 52.96.4.2    TLSv1.2 158 Application Data
  118   3.193730    52.96.4.2 → 192.168.0.26 TCP 60 993 → 62204 [ACK] Seq=4854 Ack=523 Win=1048560 Len=0
  119   3.244139    52.96.4.2 → 192.168.0.26 TCP 170 [TCP Retransmission] 993 → 62203 [FIN, PSH, ACK] Seq=5038 Ack=727 Win=1048560 Len=116
  120   3.244247 192.168.0.26 → 52.96.4.2    TCP 54 62203 → 993 [RST] Seq=727 Win=0 Len=0
  121   3.431569    52.96.4.2 → 192.168.0.26 TCP 170 [TCP Retransmission] 993 → 62203 [FIN, PSH, ACK] Seq=5038 Ack=727 Win=1048560 Len=116
  122   3.431710 192.168.0.26 → 52.96.4.2    TCP 54 62203 → 993 [RST] Seq=727 Win=0 Len=0
  123   3.757146    52.96.4.2 → 192.168.0.26 TLSv1.2 114 Application Data
  124   3.757286 192.168.0.26 → 52.96.4.2    TCP 54 62204 → 993 [ACK] Seq=523 Ack=4914 Win=262144 Len=0
  125   3.758417 192.168.0.26 → 52.96.4.2    TLSv1.2 97 Application Data
  126   3.759235 192.168.0.26 → 52.96.4.2    TCP 54 62204 → 993 [FIN, ACK] Seq=566 Ack=4914 Win=262144 Len=0
  127   3.760673 192.168.0.26 → 52.96.4.2    TCP 78 62205 → 993 [SYN] Seq=0 Win=65535 Len=0 MSS=1460 WS=64 TSval=3298464776 TSecr=0 SACK_PERM
  128   3.789057    52.96.4.2 → 192.168.0.26 TCP 66 [TCP Dup ACK 118#1] 993 → 62204 [ACK] Seq=4914 Ack=523 Win=1048560 Len=0 SLE=566 SRE=568
  129   3.791386    52.96.4.2 → 192.168.0.26 TCP 66 993 → 62205 [SYN, ACK] Seq=0 Ack=1 Win=8190 Len=0 MSS=1460 WS=16 SACK_PERM
  130   3.791535 192.168.0.26 → 52.96.4.2    TCP 54 62205 → 993 [ACK] Seq=1 Ack=1 Win=262144 Len=0
  131   3.792108 192.168.0.26 → 52.96.4.2    TLSv1 267 Client Hello (SNI=imap-mail.outlook.com)
  132   3.794865    52.96.4.2 → 192.168.0.26 TCP 60 993 → 62204 [ACK] Seq=4914 Ack=566 Win=1048560 Len=0
  133   3.794867    52.96.4.2 → 192.168.0.26 TLSv1.2 170 Application Data
  134   3.795030 192.168.0.26 → 52.96.4.2    TCP 54 62204 → 993 [RST] Seq=566 Win=0 Len=0
  135   3.795177    52.96.4.2 → 192.168.0.26 TCP 60 993 → 62204 [FIN, ACK] Seq=5030 Ack=566 Win=1048560 Len=0
  136   3.795253 192.168.0.26 → 52.96.4.2    TCP 54 62204 → 993 [RST] Seq=566 Win=0 Len=0
  137   3.806475    52.96.4.2 → 192.168.0.26 TCP 170 [TCP Retransmission] 993 → 62203 [FIN, PSH, ACK] Seq=5038 Ack=727 Win=1048560 Len=116
  138   3.806545 192.168.0.26 → 52.96.4.2    TCP 54 62203 → 993 [RST] Seq=727 Win=0 Len=0
  139   3.861601    52.96.4.2 → 192.168.0.26 TCP 60 993 → 62205 [ACK] Seq=1 Ack=214 Win=10912 Len=0
  140   3.863180    52.96.4.2 → 192.168.0.26 SSL 1514 
  141   3.863184    52.96.4.2 → 192.168.0.26 TCP 1514 993 → 62205 [ACK] Seq=1461 Ack=214 Win=1048560 Len=1460
  142   3.863188    52.96.4.2 → 192.168.0.26 TCP 1514 993 → 62205 [ACK] Seq=2921 Ack=214 Win=1048560 Len=1460
  143   3.863192    52.96.4.2 → 192.168.0.26 TLSv1.2 106 Server Hello, Certificate, Certificate Status, Server Key Exchange, Server Hello Done
  144   3.863194    52.96.4.2 → 192.168.0.26 TCP 1514 [TCP Retransmission] 993 → 62205 [PSH, ACK] Seq=2973 Ack=214 Win=1048560 Len=1460 [TCP PDU reassembled in 143]
  145   3.863311 192.168.0.26 → 52.96.4.2    TCP 54 62205 → 993 [ACK] Seq=214 Ack=4433 Win=257728 Len=0
  146   3.863390 192.168.0.26 → 52.96.4.2    TCP 66 [TCP Dup ACK 145#1] 62205 → 993 [ACK] Seq=214 Ack=4433 Win=257728 Len=0 SLE=2973 SRE=4433
  147   3.863475 192.168.0.26 → 52.96.4.2    TCP 54 [TCP Window Update] 62205 → 993 [ACK] Seq=214 Ack=4433 Win=262144 Len=0
  148   3.880040 192.168.0.26 → 52.96.4.2    TLSv1.2 161 Client Key Exchange
  149   3.935135    52.96.4.2 → 192.168.0.26 TCP 60 993 → 62205 [ACK] Seq=4433 Ack=321 Win=1048560 Len=0
  150   3.935314 192.168.0.26 → 52.96.4.2    TLSv1.2 105 Change Cipher Spec, Encrypted Handshake Message
  151   3.966032    52.96.4.2 → 192.168.0.26 TLSv1.2 105 Change Cipher Spec, Encrypted Handshake Message
  152   3.966219 192.168.0.26 → 52.96.4.2    TCP 54 62205 → 993 [ACK] Seq=372 Ack=4484 Win=262144 Len=0
  153   3.994628    52.96.4.2 → 192.168.0.26 TLSv1.2 243 Application Data
  154   3.994727 192.168.0.26 → 52.96.4.2    TCP 54 62205 → 993 [ACK] Seq=372 Ack=4673 Win=262016 Len=0
  155   3.995649 192.168.0.26 → 52.96.4.2    TLSv1.2 101 Application Data
  156   4.025944    52.96.4.2 → 192.168.0.26 TCP 60 993 → 62205 [ACK] Seq=4673 Ack=419 Win=1048560 Len=0
  157   4.025946    52.96.4.2 → 192.168.0.26 TLSv1.2 235 Application Data
  158   4.026056 192.168.0.26 → 52.96.4.2    TCP 54 62205 → 993 [ACK] Seq=419 Ack=4854 Win=262016 Len=0
  159   4.027184 192.168.0.26 → 52.96.4.2    TLSv1.2 97 Application Data
  160   4.028056 192.168.0.26 → 52.96.4.2    TCP 54 62205 → 993 [FIN, ACK] Seq=462 Ack=4854 Win=262144 Len=0
  161   4.029465 192.168.0.26 → 52.96.4.2    TCP 78 62206 → 993 [SYN] Seq=0 Win=65535 Len=0 MSS=1460 WS=64 TSval=151900920 TSecr=0 SACK_PERM
  162   4.057700    52.96.4.2 → 192.168.0.26 TCP 66 [TCP Dup ACK 156#1] 993 → 62205 [ACK] Seq=4854 Ack=419 Win=1048560 Len=0 SLE=462 SRE=464
  163   4.058757    52.96.4.2 → 192.168.0.26 TCP 66 993 → 62206 [SYN, ACK] Seq=0 Ack=1 Win=8190 Len=0 MSS=1460 WS=16 SACK_PERM
  164   4.058901 192.168.0.26 → 52.96.4.2    TCP 54 62206 → 993 [ACK] Seq=1 Ack=1 Win=262144 Len=0
  165   4.059718 192.168.0.26 → 52.96.4.2    TLSv1 267 Client Hello (SNI=imap-mail.outlook.com)
  166   4.062623    52.96.4.2 → 192.168.0.26 TCP 60 993 → 62205 [ACK] Seq=4854 Ack=462 Win=1048560 Len=0
  167   4.062626    52.96.4.2 → 192.168.0.26 TLSv1.2 170 Application Data
  168   4.062812 192.168.0.26 → 52.96.4.2    TCP 54 62205 → 993 [RST] Seq=462 Win=0 Len=0
  169   4.063286    52.96.4.2 → 192.168.0.26 TCP 60 993 → 62205 [FIN, ACK] Seq=4970 Ack=462 Win=1048560 Len=0
  170   4.063395 192.168.0.26 → 52.96.4.2    TCP 54 62205 → 993 [RST] Seq=462 Win=0 Len=0
  171   4.088904    52.96.4.2 → 192.168.0.26 TCP 60 993 → 62206 [ACK] Seq=1 Ack=214 Win=10912 Len=0
  172   4.091043    52.96.4.2 → 192.168.0.26 SSL 1514 
  173   4.091047    52.96.4.2 → 192.168.0.26 TCP 1514 993 → 62206 [ACK] Seq=1461 Ack=214 Win=1048560 Len=1460
  174   4.091149 192.168.0.26 → 52.96.4.2    TCP 54 62206 → 993 [ACK] Seq=214 Ack=2921 Win=259264 Len=0
  175   4.091329    52.96.4.2 → 192.168.0.26 TCP 1514 993 → 62206 [ACK] Seq=2921 Ack=214 Win=1048560 Len=1460
  176   4.091332    52.96.4.2 → 192.168.0.26 TLSv1.2 106 Server Hello, Certificate, Certificate Status, Server Key Exchange, Server Hello Done
  177   4.091436 192.168.0.26 → 52.96.4.2    TCP 54 62206 → 993 [ACK] Seq=214 Ack=4433 Win=260672 Len=0
  178   4.102369    52.96.4.2 → 192.168.0.26 TCP 1514 [TCP Spurious Retransmission] 993 → 62206 [PSH, ACK] Seq=2973 Ack=214 Win=1048560 Len=1460 [TCP PDU reassembled in 176]
  179   4.102482 192.168.0.26 → 52.96.4.2    TCP 66 [TCP Dup ACK 177#1] 62206 → 993 [ACK] Seq=214 Ack=4433 Win=262144 Len=0 SLE=2973 SRE=4433
  180   4.107071 192.168.0.26 → 52.96.4.2    TLSv1.2 161 Client Key Exchange
  181   4.148813    52.96.4.2 → 192.168.0.26 TCP 60 993 → 62206 [ACK] Seq=4433 Ack=321 Win=1048560 Len=0
  182   4.148949 192.168.0.26 → 52.96.4.2    TLSv1.2 105 Change Cipher Spec, Encrypted Handshake Message
  183   4.179214    52.96.4.2 → 192.168.0.26 TLSv1.2 105 Change Cipher Spec, Encrypted Handshake Message
  184   4.179311 192.168.0.26 → 52.96.4.2    TCP 54 62206 → 993 [ACK] Seq=372 Ack=4484 Win=262144 Len=0
  185   4.208804    52.96.4.2 → 192.168.0.26 TLSv1.2 243 Application Data
  186   4.208942 192.168.0.26 → 52.96.4.2    TCP 54 62206 → 993 [ACK] Seq=372 Ack=4673 Win=262016 Len=0
  187   4.209898 192.168.0.26 → 52.96.4.2    TLSv1.2 101 Application Data
  188   4.239842    52.96.4.2 → 192.168.0.26 TLSv1.2 235 Application Data
  189   4.240024 192.168.0.26 → 52.96.4.2    TCP 54 62206 → 993 [ACK] Seq=419 Ack=4854 Win=262016 Len=0
  190   4.241382 192.168.0.26 → 52.96.4.2    TLSv1.2 97 Application Data
  191   4.242465 192.168.0.26 → 52.96.4.2    TCP 54 62206 → 993 [FIN, ACK] Seq=462 Ack=4854 Win=262144 Len=0
  192   4.244135 192.168.0.26 → 52.96.4.2    TCP 78 62207 → 993 [SYN] Seq=0 Win=65535 Len=0 MSS=1460 WS=64 TSval=1899523978 TSecr=0 SACK_PERM
  193   4.270359    52.96.4.2 → 192.168.0.26 TCP 60 993 → 62206 [ACK] Seq=4854 Ack=462 Win=1048560 Len=0
  194   4.271205    52.96.4.2 → 192.168.0.26 TLSv1.2 170 Application Data
  195   4.271208    52.96.4.2 → 192.168.0.26 TCP 60 993 → 62206 [FIN, ACK] Seq=4970 Ack=462 Win=1048560 Len=0
  196   4.271410 192.168.0.26 → 52.96.4.2    TCP 54 62206 → 993 [RST] Seq=462 Win=0 Len=0
  197   4.271482 192.168.0.26 → 52.96.4.2    TCP 54 62206 → 993 [RST] Seq=462 Win=0 Len=0
  198   4.271767    52.96.4.2 → 192.168.0.26 TCP 60 993 → 62206 [ACK] Seq=4971 Ack=463 Win=1048560 Len=0
  199   4.271873 192.168.0.26 → 52.96.4.2    TCP 54 62206 → 993 [RST] Seq=463 Win=0 Len=0
  200   4.274782    52.96.4.2 → 192.168.0.26 TCP 66 993 → 62207 [SYN, ACK] Seq=0 Ack=1 Win=8190 Len=0 MSS=1460 WS=16 SACK_PERM
  201   4.274981 192.168.0.26 → 52.96.4.2    TCP 54 62207 → 993 [ACK] Seq=1 Ack=1 Win=262144 Len=0
  202   4.275862 192.168.0.26 → 52.96.4.2    TLSv1 267 Client Hello (SNI=imap-mail.outlook.com)
  203   4.308449    52.96.4.2 → 192.168.0.26 SSL 1514 
  204   4.308452    52.96.4.2 → 192.168.0.26 TCP 1514 993 → 62207 [ACK] Seq=1461 Ack=214 Win=1048560 Len=1460
  205   4.308585 192.168.0.26 → 52.96.4.2    TCP 54 62207 → 993 [ACK] Seq=214 Ack=2921 Win=259264 Len=0
  206   4.308782    52.96.4.2 → 192.168.0.26 TCP 1514 993 → 62207 [ACK] Seq=2921 Ack=214 Win=1048560 Len=1460
  207   4.308785    52.96.4.2 → 192.168.0.26 TLSv1.2 106 Server Hello, Certificate, Certificate Status, Server Key Exchange, Server Hello Done
  208   4.308909 192.168.0.26 → 52.96.4.2    TCP 54 62207 → 993 [ACK] Seq=214 Ack=4433 Win=260672 Len=0
  209   4.318314    52.96.4.2 → 192.168.0.26 TCP 1514 [TCP Spurious Retransmission] 993 → 62207 [PSH, ACK] Seq=2973 Ack=214 Win=1048560 Len=1460 [TCP PDU reassembled in 207]
  210   4.318426 192.168.0.26 → 52.96.4.2    TCP 66 [TCP Dup ACK 208#1] 62207 → 993 [ACK] Seq=214 Ack=4433 Win=262144 Len=0 SLE=2973 SRE=4433
  211   4.325332 192.168.0.26 → 52.96.4.2    TLSv1.2 161 Client Key Exchange
  212   4.364883    52.96.4.2 → 192.168.0.26 TCP 60 993 → 62207 [ACK] Seq=4433 Ack=321 Win=1048560 Len=0
  213   4.364991 192.168.0.26 → 52.96.4.2    TLSv1.2 105 Change Cipher Spec, Encrypted Handshake Message
  214   4.394255    52.96.4.2 → 192.168.0.26 TLSv1.2 105 Change Cipher Spec, Encrypted Handshake Message
  215   4.394364 192.168.0.26 → 52.96.4.2    TCP 54 62207 → 993 [ACK] Seq=372 Ack=4484 Win=262144 Len=0
  216   4.398864    52.96.4.2 → 192.168.0.26 TCP 170 [TCP Retransmission] 993 → 62206 [FIN, PSH, ACK] Seq=4854 Ack=463 Win=1048560 Len=116
  217   4.398946 192.168.0.26 → 52.96.4.2    TCP 54 62206 → 993 [RST] Seq=463 Win=0 Len=0
  218   4.423093    52.96.4.2 → 192.168.0.26 TLSv1.2 243 Application Data
  219   4.423202 192.168.0.26 → 52.96.4.2    TCP 54 62207 → 993 [ACK] Seq=372 Ack=4673 Win=262016 Len=0
  220   4.424051 192.168.0.26 → 52.96.4.2    TLSv1.2 101 Application Data
  221   4.451972    52.96.4.2 → 192.168.0.26 TLSv1.2 235 Application Data
  222   4.452119 192.168.0.26 → 52.96.4.2    TCP 54 62207 → 993 [ACK] Seq=419 Ack=4854 Win=262016 Len=0
  223   4.453112 192.168.0.26 → 52.96.4.2    TLSv1.2 130 Application Data
  224   4.505425    52.96.4.2 → 192.168.0.26 TCP 60 993 → 62207 [ACK] Seq=4854 Ack=495 Win=1048560 Len=0
  225   4.539554    52.96.4.2 → 192.168.0.26 TCP 170 [TCP Retransmission] 993 → 62206 [FIN, PSH, ACK] Seq=4854 Ack=463 Win=1048560 Len=116
  226   4.539663 192.168.0.26 → 52.96.4.2    TCP 54 62206 → 993 [RST] Seq=463 Win=0 Len=0
  227   4.541071    52.96.4.2 → 192.168.0.26 TCP 170 [TCP Retransmission] 993 → 62203 [FIN, PSH, ACK] Seq=5038 Ack=727 Win=1048560 Len=116
  228   4.541161 192.168.0.26 → 52.96.4.2    TCP 54 62203 → 993 [RST] Seq=727 Win=0 Len=0
  229   4.711344    52.96.4.2 → 192.168.0.26 TCP 170 [TCP Retransmission] 993 → 62206 [FIN, PSH, ACK] Seq=4854 Ack=463 Win=1048560 Len=116
  230   4.711473 192.168.0.26 → 52.96.4.2    TCP 54 62206 → 993 [RST] Seq=463 Win=0 Len=0
  231   5.088345    52.96.4.2 → 192.168.0.26 TCP 170 [TCP Retransmission] 993 → 62206 [FIN, PSH, ACK] Seq=4854 Ack=463 Win=1048560 Len=116
  232   5.088460 192.168.0.26 → 52.96.4.2    TCP 54 62206 → 993 [RST] Seq=463 Win=0 Len=0
  233   5.395903    52.96.4.2 → 192.168.0.26 TLSv1.2 107 Application Data
  234   5.396033 192.168.0.26 → 52.96.4.2    TCP 54 62207 → 993 [ACK] Seq=495 Ack=4907 Win=262144 Len=0
  235   5.397124 192.168.0.26 → 52.96.4.2    TLSv1.2 97 Application Data
  236   5.397913 192.168.0.26 → 52.96.4.2    TCP 54 62207 → 993 [FIN, ACK] Seq=538 Ack=4907 Win=262144 Len=0
  237   5.426143    52.96.4.2 → 192.168.0.26 TCP 66 [TCP Dup ACK 224#1] 993 → 62207 [ACK] Seq=4907 Ack=495 Win=1048560 Len=0 SLE=538 SRE=540
  238   5.426146    52.96.4.2 → 192.168.0.26 TCP 60 993 → 62207 [ACK] Seq=4907 Ack=538 Win=1048560 Len=0
  239   5.426536    52.96.4.2 → 192.168.0.26 TLSv1.2 170 Application Data
  240   5.426538    52.96.4.2 → 192.168.0.26 TCP 60 993 → 62207 [FIN, ACK] Seq=5023 Ack=538 Win=1048560 Len=0
  241   5.426707 192.168.0.26 → 52.96.4.2    TCP 54 62207 → 993 [RST] Seq=538 Win=0 Len=0
  242   5.426772 192.168.0.26 → 52.96.4.2    TCP 54 62207 → 993 [RST] Seq=538 Win=0 Len=0
  243   5.702786    52.96.4.2 → 192.168.0.26 TCP 170 [TCP Retransmission] 993 → 62206 [FIN, PSH, ACK] Seq=4854 Ack=463 Win=1048560 Len=116
  244   5.702903 192.168.0.26 → 52.96.4.2    TCP 54 62206 → 993 [RST] Seq=463 Win=0 Len=0
  245   6.114031    52.96.4.2 → 192.168.0.26 TCP 170 [TCP Retransmission] 993 → 62203 [FIN, PSH, ACK] Seq=5038 Ack=727 Win=1048560 Len=116
  246   6.114196 192.168.0.26 → 52.96.4.2    TCP 54 62203 → 993 [RST] Seq=727 Win=0 Len=0
  247   6.156033 192.168.0.26 → 172.64.41.4  TLSv1.2 122 Application Data
  248   6.156243 192.168.0.26 → 172.64.41.4  TLSv1.2 225 Application Data
  249   6.156610 192.168.0.26 → 172.64.41.4  TLSv1.2 122 Application Data
  250   6.156710 192.168.0.26 → 172.64.41.4  TLSv1.2 225 Application Data
  251   6.169494  172.64.41.4 → 192.168.0.26 TCP 66 443 → 62162 [ACK] Seq=1 Ack=216 Win=16 Len=0 TSval=4037282139 TSecr=235659569
  252   6.171345  172.64.41.4 → 192.168.0.26 TCP 66 443 → 62162 [ACK] Seq=1 Ack=431 Win=16 Len=0 TSval=4037282141 TSecr=235659569
  253   6.172791  172.64.41.4 → 192.168.0.26 TLSv1.2 145 Application Data
  254   6.172794  172.64.41.4 → 192.168.0.26 TLSv1.2 565 Application Data
  255   6.172797  172.64.41.4 → 192.168.0.26 TLSv1.2 122 Application Data
  256   6.172799  172.64.41.4 → 192.168.0.26 TLSv1.2 565 Application Data
  257   6.173008 192.168.0.26 → 172.64.41.4  TCP 66 62162 → 443 [ACK] Seq=431 Ack=1134 Win=2031 Len=0 TSval=235659586 TSecr=4037282143
  258   6.300664 192.168.0.26 → 224.0.0.251  MDNS 111 Standard query 0x0000 SRV HP ENVY 6400 series [5C484F]._ipps._tcp.local, "QU" question TXT HP ENVY 6400 series [5C484F]._ipps._tcp.local, "QU" question
  259   6.300796 fe80::1812:2907:93cd:78ac → ff02::fb     MDNS 131 Standard query 0x0000 SRV HP ENVY 6400 series [5C484F]._ipps._tcp.local, "QU" question TXT HP ENVY 6400 series [5C484F]._ipps._tcp.local, "QU" question
  260   6.761466 192.168.0.26 → 172.64.41.4  TLSv1.2 122 Application Data
  261   6.761570 192.168.0.26 → 172.64.41.4  TLSv1.2 225 Application Data
  262   6.761762 192.168.0.26 → 172.64.41.4  TLSv1.2 122 Application Data
  263   6.761804 192.168.0.26 → 172.64.41.4  TLSv1.2 225 Application Data
  264   6.764302 192.168.0.26 → 3.233.158.25 TCP 78 62208 → 443 [SYN] Seq=0 Win=65535 Len=0 MSS=1460 WS=64 TSval=1231107579 TSecr=0 SACK_PERM
  265   6.777106  172.64.41.4 → 192.168.0.26 TLSv1.2 101 Application Data
  266   6.777264 192.168.0.26 → 172.64.41.4  TCP 66 62162 → 443 [ACK] Seq=861 Ack=1169 Win=2048 Len=0 TSval=235660190 TSecr=4037282747
  267   6.777847  172.64.41.4 → 192.168.0.26 TCP 66 443 → 62162 [ACK] Seq=1169 Ack=861 Win=16 Len=0 TSval=4037282748 TSecr=235660174
  268   6.779464  172.64.41.4 → 192.168.0.26 TLSv1.2 122 Application Data
  269   6.779534 192.168.0.26 → 172.64.41.4  TCP 66 62162 → 443 [ACK] Seq=861 Ack=1225 Win=2048 Len=0 TSval=235660192 TSecr=4037282750
  270   6.779760  172.64.41.4 → 192.168.0.26 TLSv1.2 565 Application Data
  271   6.779846 192.168.0.26 → 172.64.41.4  TCP 66 62162 → 443 [ACK] Seq=861 Ack=1724 Win=2041 Len=0 TSval=235660192 TSecr=4037282750
  272   6.781211  172.64.41.4 → 192.168.0.26 TLSv1.2 122 Application Data
  273   6.781213  172.64.41.4 → 192.168.0.26 TLSv1.2 565 Application Data
  274   6.781281 192.168.0.26 → 172.64.41.4  TCP 66 62162 → 443 [ACK] Seq=861 Ack=2279 Win=2040 Len=0 TSval=235660194 TSecr=4037282751
  275   6.819109 3.233.158.25 → 192.168.0.26 TCP 74 443 → 62208 [SYN, ACK] Seq=0 Ack=1 Win=31668 Len=0 MSS=1230 SACK_PERM TSval=4031668742 TSecr=1231107579 WS=512
  276   6.819296 192.168.0.26 → 3.233.158.25 TCP 66 62208 → 443 [ACK] Seq=1 Ack=1 Win=131584 Len=0 TSval=1231107634 TSecr=4031668742
  277   6.820755 192.168.0.26 → 3.233.158.25 SSL 1284 
  278   6.820791 192.168.0.26 → 3.233.158.25 TLSv1.2 1252 Client Hello (SNI=browser-intake-datadoghq.com)
  279   6.876512 3.233.158.25 → 192.168.0.26 TCP 66 443 → 62208 [ACK] Seq=1 Ack=2405 Win=36352 Len=0 TSval=4031668799 TSecr=1231107636
  280   6.877180 3.233.158.25 → 192.168.0.26 TLSv1.3 1284 Server Hello, Change Cipher Spec
  281   6.877296 192.168.0.26 → 3.233.158.25 TCP 66 62208 → 443 [ACK] Seq=2405 Ack=1219 Win=130368 Len=0 TSval=1231107691 TSecr=4031668800
  282   6.877582 3.233.158.25 → 192.168.0.26 TCP 1284 443 → 62208 [PSH, ACK] Seq=1219 Ack=2405 Win=36352 Len=1218 TSval=4031668800 TSecr=1231107636
  283   6.877586 3.233.158.25 → 192.168.0.26 TLSv1.3 1158 Application Data
  284   6.877706 192.168.0.26 → 3.233.158.25 TCP 66 62208 → 443 [ACK] Seq=2405 Ack=3529 Win=128064 Len=0 TSval=1231107693 TSecr=4031668800
  285   6.878032 192.168.0.26 → 3.233.158.25 TCP 66 [TCP Window Update] 62208 → 443 [ACK] Seq=2405 Ack=3529 Win=131072 Len=0 TSval=1231107693 TSecr=4031668800
  286   6.880907 192.168.0.26 → 3.233.158.25 TLSv1.3 130 Change Cipher Spec, Application Data
  287   6.881543 192.168.0.26 → 3.233.158.25 TLSv1.3 158 Application Data
  288   6.881658 192.168.0.26 → 3.233.158.25 TLSv1.3 606 Application Data
  289   6.881724 192.168.0.26 → 3.233.158.25 TLSv1.3 1256 Application Data
  290   6.899498    52.96.4.2 → 192.168.0.26 TCP 170 [TCP Retransmission] 993 → 62206 [FIN, PSH, ACK] Seq=4854 Ack=463 Win=1048560 Len=116
  291   6.899615 192.168.0.26 → 52.96.4.2    TCP 54 62206 → 993 [RST] Seq=463 Win=0 Len=0
  292   6.946619 3.233.158.25 → 192.168.0.26 TCP 66 443 → 62208 [ACK] Seq=3529 Ack=3101 Win=38912 Len=0 TSval=4031668863 TSecr=1231107696
  293   6.946623 3.233.158.25 → 192.168.0.26 TLSv1.3 593 Application Data, Application Data
  294   6.946857 192.168.0.26 → 3.233.158.25 TCP 66 62208 → 443 [ACK] Seq=4291 Ack=4056 Win=130560 Len=0 TSval=1231107762 TSecr=4031668863
  295   6.947985 192.168.0.26 → 3.233.158.25 TLSv1.3 97 Application Data
  296   6.956989 192.168.0.26 → 162.247.243.29 TCP 54 62131 → 443 [ACK] Seq=1 Ack=1 Win=2048 Len=0
  297   6.963998 192.168.0.26 → 162.247.243.29 TLSv1.2 1037 [TCP Previous segment not captured] , Application Data
  298   6.973948 162.247.243.29 → 192.168.0.26 TCP 66 [TCP ACKed unseen segment] 443 → 62131 [ACK] Seq=1 Ack=2 Win=366 Len=0 TSval=3691176576 TSecr=1928614764
  299   6.978324 3.233.158.25 → 192.168.0.26 TLSv1.3 375 Application Data
  300   6.978523 192.168.0.26 → 3.233.158.25 TCP 66 62208 → 443 [ACK] Seq=4322 Ack=4365 Win=130816 Len=0 TSval=1231107793 TSecr=4031668899
  301   6.981782 162.247.243.29 → 192.168.0.26 TCP 66 443 → 62131 [ACK] Seq=1 Ack=973 Win=370 Len=0 TSval=3691176585 TSecr=1928624772
  302   7.021766 162.247.243.29 → 192.168.0.26 TLSv1.2 486 Application Data, Application Data
  303   7.021949 192.168.0.26 → 162.247.243.29 TCP 66 62131 → 443 [ACK] Seq=973 Ack=421 Win=2042 Len=0 TSval=1928624830 TSecr=3691176625
  304   7.045780 3.233.158.25 → 192.168.0.26 TCP 66 443 → 62208 [ACK] Seq=4365 Ack=4322 Win=41472 Len=0 TSval=4031668969 TSecr=1231107763
  305   7.303333 192.168.0.26 → 224.0.0.251  MDNS 111 Standard query 0x0000 SRV HP ENVY 6400 series [5C484F]._ipps._tcp.local, "QM" question TXT HP ENVY 6400 series [5C484F]._ipps._tcp.local, "QM" question
  306   7.303386 fe80::1812:2907:93cd:78ac → ff02::fb     MDNS 131 Standard query 0x0000 SRV HP ENVY 6400 series [5C484F]._ipps._tcp.local, "QM" question TXT HP ENVY 6400 series [5C484F]._ipps._tcp.local, "QM" question
  307   8.980338    52.96.4.2 → 192.168.0.26 TCP 170 [TCP Retransmission] 993 → 62203 [FIN, PSH, ACK] Seq=5038 Ack=727 Win=1048560 Len=116
  308   8.980541 192.168.0.26 → 52.96.4.2    TCP 54 62203 → 993 [RST] Seq=727 Win=0 Len=0
  309   9.491466    52.96.4.2 → 192.168.0.26 TCP 170 [TCP Retransmission] 993 → 62206 [FIN, PSH, ACK] Seq=4854 Ack=463 Win=1048560 Len=116
  310   9.491584 192.168.0.26 → 52.96.4.2    TCP 54 62206 → 993 [RST] Seq=463 Win=0 Len=0
  311  10.311179 192.168.0.26 → 224.0.0.251  MDNS 111 Standard query 0x0000 SRV HP ENVY 6400 series [5C484F]._ipps._tcp.local, "QM" question TXT HP ENVY 6400 series [5C484F]._ipps._tcp.local, "QM" question
  312  10.311337 fe80::1812:2907:93cd:78ac → ff02::fb     MDNS 131 Standard query 0x0000 SRV HP ENVY 6400 series [5C484F]._ipps._tcp.local, "QM" question TXT HP ENVY 6400 series [5C484F]._ipps._tcp.local, "QM" question
  313  14.406994    52.96.4.2 → 192.168.0.26 TCP 170 [TCP Retransmission] 993 → 62206 [FIN, PSH, ACK] Seq=4854 Ack=463 Win=1048560 Len=116
  314  14.407128 192.168.0.26 → 52.96.4.2    TCP 54 62206 → 993 [RST] Seq=463 Win=0 Len=0
  315  14.816788    52.96.4.2 → 192.168.0.26 TCP 170 [TCP Retransmission] 993 → 62203 [FIN, PSH, ACK] Seq=5038 Ack=727 Win=1048560 Len=116
  316  14.816930 192.168.0.26 → 52.96.4.2    TCP 54 62203 → 993 [RST] Seq=727 Win=0 Len=0
  317  17.022783 192.168.0.26 → 162.247.243.29 TCP 54 [TCP Keep-Alive] 62131 → 443 [ACK] Seq=972 Ack=421 Win=2048 Len=0
  318  17.033256 192.168.0.26 → 162.247.243.29 TLSv1.2 1037 Application Data
  319  17.045373 162.247.243.29 → 192.168.0.26 TCP 66 [TCP Dup ACK 301#1] 443 → 62131 [ACK] Seq=421 Ack=973 Win=370 Len=0 TSval=3691186648 TSecr=1928624830
  320  17.052129 162.247.243.29 → 192.168.0.26 TCP 66 443 → 62131 [ACK] Seq=421 Ack=1944 Win=374 Len=0 TSval=3691186655 TSecr=1928634841
  321  17.087231 162.247.243.29 → 192.168.0.26 TLSv1.2 486 Application Data, Application Data
  322  17.087397 192.168.0.26 → 162.247.243.29 TCP 66 62131 → 443 [ACK] Seq=1944 Ack=841 Win=2042 Len=0 TSval=1928634895 TSecr=3691186690
  323  19.329135 192.168.0.26 → 224.0.0.251  MDNS 111 Standard query 0x0000 SRV HP ENVY 6400 series [5C484F]._ipps._tcp.local, "QM" question TXT HP ENVY 6400 series [5C484F]._ipps._tcp.local, "QM" question
  324  19.329201 fe80::1812:2907:93cd:78ac → ff02::fb     MDNS 131 Standard query 0x0000 SRV HP ENVY 6400 series [5C484F]._ipps._tcp.local, "QM" question TXT HP ENVY 6400 series [5C484F]._ipps._tcp.local, "QM" question
  325  20.038185 Netgear_cd:65:97 → Broadcast    ARP 60 Who has 192.168.0.9? Tell 192.168.0.1
  326  20.550144 Netgear_cd:65:97 → Broadcast    ARP 60 Who has 192.168.0.10? Tell 192.168.0.1
  327  20.652537 Netgear_cd:65:97 → Broadcast    ARP 60 Who has 192.168.0.15? Tell 192.168.0.1
  328  20.755003 Netgear_cd:65:97 → Broadcast    ARP 60 Who has 192.168.0.16? Tell 192.168.0.1
  329  20.755006 Netgear_cd:65:97 → Broadcast    ARP 60 Who has 192.168.0.17? Tell 192.168.0.1
  330  20.859713 Netgear_cd:65:97 → Broadcast    ARP 60 Who has 192.168.0.26? Tell 192.168.0.1
  331  20.859800 82:41:23:21:c2:18 → Netgear_cd:65:97 ARP 42 192.168.0.26 is at 82:41:23:21:c2:18
  332  20.959768 Netgear_cd:65:97 → Broadcast    ARP 60 Who has 192.168.0.254? Tell 192.168.0.1
  333  24.909023 192.168.0.26 → 104.18.32.47 SSL 1454 
  334  24.909029 192.168.0.26 → 104.18.32.47 TCP 1454 61956 → 443 [ACK] Seq=1389 Ack=1 Win=2048 Len=1388 TSval=1066317512 TSecr=2073190421
  335  24.909031 192.168.0.26 → 104.18.32.47 TCP 1454 61956 → 443 [ACK] Seq=2777 Ack=1 Win=2048 Len=1388 TSval=1066317512 TSecr=2073190421
  336  24.909089 192.168.0.26 → 104.18.32.47 TLSv1.2 516 Application Data
  337  24.909201 192.168.0.26 → 104.18.32.47 TLSv1.2 328 Application Data
  338  24.936534 104.18.32.47 → 192.168.0.26 TCP 66 443 → 61956 [ACK] Seq=1 Ack=4165 Win=16 Len=0 TSval=2073218707 TSecr=1066317512
  339  24.936538 104.18.32.47 → 192.168.0.26 TCP 66 443 → 61956 [ACK] Seq=1 Ack=4877 Win=16 Len=0 TSval=2073218708 TSecr=1066317512
  340  25.569510 104.18.32.47 → 192.168.0.26 TLSv1.2 414 Application Data
  341  25.569514 104.18.32.47 → 192.168.0.26 TLSv1.2 101 Application Data
  342  25.569516 104.18.32.47 → 192.168.0.26 TLSv1.2 97 Application Data
  343  25.569517 104.18.32.47 → 192.168.0.26 TCP 97 [TCP Retransmission] 443 → 61956 [PSH, ACK] Seq=384 Ack=4877 Win=16 Len=31 TSval=2073219349 TSecr=1066317512
  344  25.569688 192.168.0.26 → 104.18.32.47 TCP 66 61956 → 443 [ACK] Seq=4877 Ack=415 Win=2042 Len=0 TSval=1066318172 TSecr=2073219263
  345  25.569796 192.168.0.26 → 104.18.32.47 TCP 78 [TCP Dup ACK 344#1] 61956 → 443 [ACK] Seq=4877 Ack=415 Win=2042 Len=0 TSval=1066318172 TSecr=2073219349 SLE=384 SRE=415
